
*** Running vivado
    with args -log Wrapper.vds -m64 -product Vivado -mode batch -messageDb vivado.pb -notrace -source Wrapper.tcl



****** Vivado v2020.1 (64-bit)
  **** SW Build 2902540 on Wed May 27 19:54:49 MDT 2020
  **** IP Build 2902112 on Wed May 27 22:43:36 MDT 2020
    ** Copyright 1986-2020 Xilinx, Inc. All Rights Reserved.

source Wrapper.tcl -notrace
Command: synth_design -top Wrapper -part xc7a100tcsg324-1
Starting synth_design
Attempting to get a license for feature 'Synthesis' and/or device 'xc7a100t'
INFO: [Common 17-349] Got license for feature 'Synthesis' and/or device 'xc7a100t'
INFO: [Device 21-403] Loading part xc7a100tcsg324-1
INFO: [Synth 8-7079] Multithreading enabled for synth_design using a maximum of 2 processes.
INFO: [Synth 8-7078] Launching helper process for spawning children vivado processes
INFO: [Synth 8-7075] Helper process launched with PID 76464
WARNING: [Synth 8-6901] identifier 'isMultDiv' is used before its declaration [C:/Users/rrwth/OneDrive/Documents/College/ECE350/Checkpoints/processor/processor.v:67]
WARNING: [Synth 8-6901] identifier 'multDivReady' is used before its declaration [C:/Users/rrwth/OneDrive/Documents/College/ECE350/Checkpoints/processor/processor.v:67]
WARNING: [Synth 8-6901] identifier 'bypassedA' is used before its declaration [C:/Users/rrwth/OneDrive/Documents/College/ECE350/Checkpoints/processor/processor.v:74]
WARNING: [Synth 8-6901] identifier 'latchXM_O' is used before its declaration [C:/Users/rrwth/OneDrive/Documents/College/ECE350/Checkpoints/processor/processor.v:128]
WARNING: [Synth 8-6901] identifier 'writebackShouldWriteReg' is used before its declaration [C:/Users/rrwth/OneDrive/Documents/College/ECE350/Checkpoints/processor/processor.v:129]
WARNING: [Synth 8-6901] identifier 'latchXM_O' is used before its declaration [C:/Users/rrwth/OneDrive/Documents/College/ECE350/Checkpoints/processor/processor.v:130]
WARNING: [Synth 8-6901] identifier 'writebackShouldWriteReg' is used before its declaration [C:/Users/rrwth/OneDrive/Documents/College/ECE350/Checkpoints/processor/processor.v:131]
WARNING: [Synth 8-6901] identifier 'writebackShouldWriteReg' is used before its declaration [C:/Users/rrwth/OneDrive/Documents/College/ECE350/Checkpoints/processor/processor.v:178]
WARNING: [Synth 8-6901] identifier 'SD_responseBuffer' is used before its declaration [C:/Users/rrwth/OneDrive/Documents/College/ECE350/Checkpoints/processor/MemoryMap.v:23]
WARNING: [Synth 8-6901] identifier 'startPulse' is used before its declaration [C:/Users/rrwth/OneDrive/Documents/College/ECE350/Checkpoints/processor/SDController.v:34]
WARNING: [Synth 8-6901] identifier 'cmdBuffer' is used before its declaration [C:/Users/rrwth/OneDrive/Documents/College/ECE350/Checkpoints/processor/SDController.v:38]
---------------------------------------------------------------------------------
Starting RTL Elaboration : Time (s): cpu = 00:00:05 ; elapsed = 00:00:05 . Memory (MB): peak = 1013.492 ; gain = 0.000
---------------------------------------------------------------------------------
INFO: [Synth 8-6157] synthesizing module 'Wrapper' [C:/Users/rrwth/OneDrive/Documents/College/ECE350/Checkpoints/processor/Wrapper.v:27]
	Parameter INSTR_FILE bound to: program - type: string 
INFO: [Synth 8-6157] synthesizing module 'processor' [C:/Users/rrwth/OneDrive/Documents/College/ECE350/Checkpoints/processor/processor.v:20]
INFO: [Synth 8-6157] synthesizing module 'register32' [C:/Users/rrwth/OneDrive/Documents/College/ECE350/Checkpoints/processor/register.v:21]
INFO: [Synth 8-6157] synthesizing module 'dffe_ref' [C:/Users/rrwth/OneDrive/Documents/College/ECE350/Checkpoints/processor/dffe_ref.v:1]
INFO: [Synth 8-6155] done synthesizing module 'dffe_ref' (1#1) [C:/Users/rrwth/OneDrive/Documents/College/ECE350/Checkpoints/processor/dffe_ref.v:1]
INFO: [Synth 8-6155] done synthesizing module 'register32' (2#1) [C:/Users/rrwth/OneDrive/Documents/College/ECE350/Checkpoints/processor/register.v:21]
INFO: [Synth 8-6157] synthesizing module 'cla' [C:/Users/rrwth/OneDrive/Documents/College/ECE350/Checkpoints/processor/cla.v:1]
INFO: [Synth 8-6157] synthesizing module 'cla_block' [C:/Users/rrwth/OneDrive/Documents/College/ECE350/Checkpoints/processor/cla.v:34]
INFO: [Synth 8-6155] done synthesizing module 'cla_block' (3#1) [C:/Users/rrwth/OneDrive/Documents/College/ECE350/Checkpoints/processor/cla.v:34]
INFO: [Synth 8-6155] done synthesizing module 'cla' (4#1) [C:/Users/rrwth/OneDrive/Documents/College/ECE350/Checkpoints/processor/cla.v:1]
INFO: [Synth 8-6157] synthesizing module 'register5' [C:/Users/rrwth/OneDrive/Documents/College/ECE350/Checkpoints/processor/register.v:1]
INFO: [Synth 8-6155] done synthesizing module 'register5' (5#1) [C:/Users/rrwth/OneDrive/Documents/College/ECE350/Checkpoints/processor/register.v:1]
INFO: [Synth 8-6157] synthesizing module 'alu' [C:/Users/rrwth/OneDrive/Documents/College/ECE350/Checkpoints/processor/alu.v:1]
INFO: [Synth 8-6157] synthesizing module 'ShiftLeftLogical' [C:/Users/rrwth/OneDrive/Documents/College/ECE350/Checkpoints/processor/shift.v:1]
INFO: [Synth 8-6155] done synthesizing module 'ShiftLeftLogical' (6#1) [C:/Users/rrwth/OneDrive/Documents/College/ECE350/Checkpoints/processor/shift.v:1]
INFO: [Synth 8-6157] synthesizing module 'ShiftRightArithmetic' [C:/Users/rrwth/OneDrive/Documents/College/ECE350/Checkpoints/processor/shift.v:16]
INFO: [Synth 8-6155] done synthesizing module 'ShiftRightArithmetic' (7#1) [C:/Users/rrwth/OneDrive/Documents/College/ECE350/Checkpoints/processor/shift.v:16]
INFO: [Synth 8-6157] synthesizing module 'mux8' [C:/Users/rrwth/OneDrive/Documents/College/ECE350/Checkpoints/processor/mux.v:37]
INFO: [Synth 8-6157] synthesizing module 'mux4' [C:/Users/rrwth/OneDrive/Documents/College/ECE350/Checkpoints/processor/mux.v:15]
INFO: [Synth 8-6157] synthesizing module 'mux2' [C:/Users/rrwth/OneDrive/Documents/College/ECE350/Checkpoints/processor/mux.v:1]
INFO: [Synth 8-6155] done synthesizing module 'mux2' (8#1) [C:/Users/rrwth/OneDrive/Documents/College/ECE350/Checkpoints/processor/mux.v:1]
INFO: [Synth 8-6155] done synthesizing module 'mux4' (9#1) [C:/Users/rrwth/OneDrive/Documents/College/ECE350/Checkpoints/processor/mux.v:15]
INFO: [Synth 8-6155] done synthesizing module 'mux8' (10#1) [C:/Users/rrwth/OneDrive/Documents/College/ECE350/Checkpoints/processor/mux.v:37]
INFO: [Synth 8-6155] done synthesizing module 'alu' (11#1) [C:/Users/rrwth/OneDrive/Documents/College/ECE350/Checkpoints/processor/alu.v:1]
INFO: [Synth 8-6157] synthesizing module 'multdiv' [C:/Users/rrwth/OneDrive/Documents/College/ECE350/Checkpoints/processor/multdiv.v:1]
INFO: [Synth 8-6157] synthesizing module 'not32' [C:/Users/rrwth/OneDrive/Documents/College/ECE350/Checkpoints/processor/big_gates.v:1]
INFO: [Synth 8-6155] done synthesizing module 'not32' (12#1) [C:/Users/rrwth/OneDrive/Documents/College/ECE350/Checkpoints/processor/big_gates.v:1]
INFO: [Synth 8-6157] synthesizing module 'counter6' [C:/Users/rrwth/OneDrive/Documents/College/ECE350/Checkpoints/processor/counter.v:1]
INFO: [Synth 8-6157] synthesizing module 'tff' [C:/Users/rrwth/OneDrive/Documents/College/ECE350/Checkpoints/processor/counter.v:45]
INFO: [Synth 8-6155] done synthesizing module 'tff' (13#1) [C:/Users/rrwth/OneDrive/Documents/College/ECE350/Checkpoints/processor/counter.v:45]
INFO: [Synth 8-6155] done synthesizing module 'counter6' (14#1) [C:/Users/rrwth/OneDrive/Documents/College/ECE350/Checkpoints/processor/counter.v:1]
INFO: [Synth 8-6155] done synthesizing module 'multdiv' (15#1) [C:/Users/rrwth/OneDrive/Documents/College/ECE350/Checkpoints/processor/multdiv.v:1]
INFO: [Synth 8-6157] synthesizing module 'mux8_1b' [C:/Users/rrwth/OneDrive/Documents/College/ECE350/Checkpoints/processor/mux.v:48]
INFO: [Synth 8-6157] synthesizing module 'mux4_1b' [C:/Users/rrwth/OneDrive/Documents/College/ECE350/Checkpoints/processor/mux.v:26]
INFO: [Synth 8-6157] synthesizing module 'mux2_1b' [C:/Users/rrwth/OneDrive/Documents/College/ECE350/Checkpoints/processor/mux.v:8]
INFO: [Synth 8-6155] done synthesizing module 'mux2_1b' (16#1) [C:/Users/rrwth/OneDrive/Documents/College/ECE350/Checkpoints/processor/mux.v:8]
INFO: [Synth 8-6155] done synthesizing module 'mux4_1b' (17#1) [C:/Users/rrwth/OneDrive/Documents/College/ECE350/Checkpoints/processor/mux.v:26]
INFO: [Synth 8-6155] done synthesizing module 'mux8_1b' (18#1) [C:/Users/rrwth/OneDrive/Documents/College/ECE350/Checkpoints/processor/mux.v:48]
INFO: [Synth 8-6155] done synthesizing module 'processor' (19#1) [C:/Users/rrwth/OneDrive/Documents/College/ECE350/Checkpoints/processor/processor.v:20]
INFO: [Synth 8-6157] synthesizing module 'ROM' [C:/Users/rrwth/OneDrive/Documents/College/ECE350/Checkpoints/processor/ROM.v:2]
	Parameter DATA_WIDTH bound to: 32 - type: integer 
	Parameter ADDRESS_WIDTH bound to: 12 - type: integer 
	Parameter DEPTH bound to: 4096 - type: integer 
	Parameter MEMFILE bound to: 88'b0111000001110010011011110110011101110010011000010110110100101110011011010110010101101101 
INFO: [Synth 8-3876] $readmem data file 'program.mem' is read successfully [C:/Users/rrwth/OneDrive/Documents/College/ECE350/Checkpoints/processor/ROM.v:11]
INFO: [Synth 8-6155] done synthesizing module 'ROM' (20#1) [C:/Users/rrwth/OneDrive/Documents/College/ECE350/Checkpoints/processor/ROM.v:2]
INFO: [Synth 8-6157] synthesizing module 'regfile' [C:/Users/rrwth/OneDrive/Documents/College/ECE350/Checkpoints/processor/regfile.v:1]
INFO: [Synth 8-6157] synthesizing module 'tristate32' [C:/Users/rrwth/OneDrive/Documents/College/ECE350/Checkpoints/processor/tristate.v:1]
INFO: [Synth 8-6155] done synthesizing module 'tristate32' (21#1) [C:/Users/rrwth/OneDrive/Documents/College/ECE350/Checkpoints/processor/tristate.v:1]
INFO: [Synth 8-6157] synthesizing module 'decoder32' [C:/Users/rrwth/OneDrive/Documents/College/ECE350/Checkpoints/processor/decoder.v:1]
INFO: [Synth 8-6155] done synthesizing module 'decoder32' (22#1) [C:/Users/rrwth/OneDrive/Documents/College/ECE350/Checkpoints/processor/decoder.v:1]
INFO: [Synth 8-6155] done synthesizing module 'regfile' (23#1) [C:/Users/rrwth/OneDrive/Documents/College/ECE350/Checkpoints/processor/regfile.v:1]
INFO: [Synth 8-6157] synthesizing module 'RAM' [C:/Users/rrwth/OneDrive/Documents/College/ECE350/Checkpoints/processor/RAM.v:2]
	Parameter DATA_WIDTH bound to: 32 - type: integer 
	Parameter ADDRESS_WIDTH bound to: 12 - type: integer 
	Parameter DEPTH bound to: 4096 - type: integer 
INFO: [Synth 8-6155] done synthesizing module 'RAM' (24#1) [C:/Users/rrwth/OneDrive/Documents/College/ECE350/Checkpoints/processor/RAM.v:2]
INFO: [Synth 8-6157] synthesizing module 'SDController' [C:/Users/rrwth/OneDrive/Documents/College/ECE350/Checkpoints/processor/SDController.v:8]
INFO: [Synth 8-6157] synthesizing module 'counter4' [C:/Users/rrwth/OneDrive/Documents/College/ECE350/Checkpoints/processor/counter.v:19]
INFO: [Synth 8-6155] done synthesizing module 'counter4' (25#1) [C:/Users/rrwth/OneDrive/Documents/College/ECE350/Checkpoints/processor/counter.v:19]
INFO: [Synth 8-6155] done synthesizing module 'SDController' (26#1) [C:/Users/rrwth/OneDrive/Documents/College/ECE350/Checkpoints/processor/SDController.v:8]
INFO: [Synth 8-6157] synthesizing module 'MemoryMap' [C:/Users/rrwth/OneDrive/Documents/College/ECE350/Checkpoints/processor/MemoryMap.v:1]
WARNING: [Synth 8-567] referenced signal 'SD_responseBuffer' should be on the sensitivity list [C:/Users/rrwth/OneDrive/Documents/College/ECE350/Checkpoints/processor/MemoryMap.v:17]
WARNING: [Synth 8-567] referenced signal 'SD_cmd' should be on the sensitivity list [C:/Users/rrwth/OneDrive/Documents/College/ECE350/Checkpoints/processor/MemoryMap.v:17]
WARNING: [Synth 8-567] referenced signal 'writeEnable' should be on the sensitivity list [C:/Users/rrwth/OneDrive/Documents/College/ECE350/Checkpoints/processor/MemoryMap.v:17]
WARNING: [Synth 8-567] referenced signal 'dataIn' should be on the sensitivity list [C:/Users/rrwth/OneDrive/Documents/College/ECE350/Checkpoints/processor/MemoryMap.v:17]
WARNING: [Synth 8-567] referenced signal 'SD_start' should be on the sensitivity list [C:/Users/rrwth/OneDrive/Documents/College/ECE350/Checkpoints/processor/MemoryMap.v:17]
WARNING: [Synth 8-567] referenced signal 'SD_response' should be on the sensitivity list [C:/Users/rrwth/OneDrive/Documents/College/ECE350/Checkpoints/processor/MemoryMap.v:45]
INFO: [Synth 8-6155] done synthesizing module 'MemoryMap' (27#1) [C:/Users/rrwth/OneDrive/Documents/College/ECE350/Checkpoints/processor/MemoryMap.v:1]
WARNING: [Synth 8-4446] all outputs are unconnected for this instance and logic may be removed [C:/Users/rrwth/OneDrive/Documents/College/ECE350/Checkpoints/processor/Wrapper.v:111]
INFO: [Synth 8-6157] synthesizing module 'ila_0' [C:/Users/rrwth/OneDrive/Documents/College/ECE350/Checkpoints/processor/Vivado/Vivado.runs/synth_1/.Xil/Vivado-74088-DESKTOP-VN8895K/realtime/ila_0_stub.v:6]
INFO: [Synth 8-6155] done synthesizing module 'ila_0' (28#1) [C:/Users/rrwth/OneDrive/Documents/College/ECE350/Checkpoints/processor/Vivado/Vivado.runs/synth_1/.Xil/Vivado-74088-DESKTOP-VN8895K/realtime/ila_0_stub.v:6]
INFO: [Synth 8-6071] Mark debug on the nets applies keep_hierarchy on instance 'debugger'. This will prevent further optimization [C:/Users/rrwth/OneDrive/Documents/College/ECE350/Checkpoints/processor/Wrapper.v:111]
INFO: [Synth 8-6071] Mark debug on the nets applies keep_hierarchy on instance 'SDModule'. This will prevent further optimization [C:/Users/rrwth/OneDrive/Documents/College/ECE350/Checkpoints/processor/Wrapper.v:102]
INFO: [Synth 8-6071] Mark debug on the nets applies keep_hierarchy on instance 'MemMap'. This will prevent further optimization [C:/Users/rrwth/OneDrive/Documents/College/ECE350/Checkpoints/processor/Wrapper.v:104]
INFO: [Synth 8-6071] Mark debug on the nets applies keep_hierarchy on instance 'CPU'. This will prevent further optimization [C:/Users/rrwth/OneDrive/Documents/College/ECE350/Checkpoints/processor/Wrapper.v:47]
INFO: [Synth 8-6071] Mark debug on the nets applies keep_hierarchy on instance 'ProcMem'. This will prevent further optimization [C:/Users/rrwth/OneDrive/Documents/College/ECE350/Checkpoints/processor/Wrapper.v:79]
INFO: [Synth 8-6155] done synthesizing module 'Wrapper' (29#1) [C:/Users/rrwth/OneDrive/Documents/College/ECE350/Checkpoints/processor/Wrapper.v:27]
---------------------------------------------------------------------------------
Finished RTL Elaboration : Time (s): cpu = 00:00:07 ; elapsed = 00:00:07 . Memory (MB): peak = 1013.492 ; gain = 0.000
---------------------------------------------------------------------------------
---------------------------------------------------------------------------------
Start Handling Custom Attributes
---------------------------------------------------------------------------------
---------------------------------------------------------------------------------
Finished Handling Custom Attributes : Time (s): cpu = 00:00:08 ; elapsed = 00:00:08 . Memory (MB): peak = 1013.492 ; gain = 0.000
---------------------------------------------------------------------------------
---------------------------------------------------------------------------------
Finished RTL Optimization Phase 1 : Time (s): cpu = 00:00:08 ; elapsed = 00:00:08 . Memory (MB): peak = 1013.492 ; gain = 0.000
---------------------------------------------------------------------------------
Netlist sorting complete. Time (s): cpu = 00:00:00 ; elapsed = 00:00:00.160 . Memory (MB): peak = 1013.492 ; gain = 0.000
INFO: [Project 1-570] Preparing netlist for logic optimization

Processing XDC Constraints
Initializing timing engine
Parsing XDC File [c:/Users/rrwth/OneDrive/Documents/College/ECE350/Checkpoints/processor/Vivado/Vivado.srcs/sources_1/ip/ila_0/ila_0/ila_0_in_context.xdc] for cell 'debugger'
Finished Parsing XDC File [c:/Users/rrwth/OneDrive/Documents/College/ECE350/Checkpoints/processor/Vivado/Vivado.srcs/sources_1/ip/ila_0/ila_0/ila_0_in_context.xdc] for cell 'debugger'
Parsing XDC File [C:/Users/rrwth/OneDrive/Documents/College/ECE350/Checkpoints/processor/constraints.xdc]
Finished Parsing XDC File [C:/Users/rrwth/OneDrive/Documents/College/ECE350/Checkpoints/processor/constraints.xdc]
INFO: [Project 1-236] Implementation specific constraints were found while reading constraint file [C:/Users/rrwth/OneDrive/Documents/College/ECE350/Checkpoints/processor/constraints.xdc]. These constraints will be ignored for synthesis but will be used in implementation. Impacted constraints are listed in the file [.Xil/Wrapper_propImpl.xdc].
Resolution: To avoid this warning, move constraints listed in [.Xil/Wrapper_propImpl.xdc] to another XDC file and exclude this new file from synthesis with the used_in_synthesis property (File Properties dialog in GUI) and re-run elaboration/synthesis.
Completed Processing XDC Constraints

Netlist sorting complete. Time (s): cpu = 00:00:00 ; elapsed = 00:00:00.006 . Memory (MB): peak = 1087.145 ; gain = 0.000
INFO: [Project 1-111] Unisim Transformation Summary:
No Unisim elements were transformed.

Constraint Validation Runtime : Time (s): cpu = 00:00:00 ; elapsed = 00:00:00.027 . Memory (MB): peak = 1087.145 ; gain = 0.000
---------------------------------------------------------------------------------
Finished Constraint Validation : Time (s): cpu = 00:00:16 ; elapsed = 00:00:16 . Memory (MB): peak = 1087.145 ; gain = 73.652
---------------------------------------------------------------------------------
---------------------------------------------------------------------------------
Start Loading Part and Timing Information
---------------------------------------------------------------------------------
Loading part: xc7a100tcsg324-1
---------------------------------------------------------------------------------
Finished Loading Part and Timing Information : Time (s): cpu = 00:00:16 ; elapsed = 00:00:16 . Memory (MB): peak = 1087.145 ; gain = 73.652
---------------------------------------------------------------------------------
---------------------------------------------------------------------------------
Start Applying 'set_property' XDC Constraints
---------------------------------------------------------------------------------
Applied set_property DONT_TOUCH = true for debugger. (constraint file  auto generated constraint, line ).
---------------------------------------------------------------------------------
Finished applying 'set_property' XDC Constraints : Time (s): cpu = 00:00:16 ; elapsed = 00:00:16 . Memory (MB): peak = 1087.145 ; gain = 73.652
---------------------------------------------------------------------------------
WARNING: [Synth 8-327] inferring latch for variable 'SD_cmd_reg' [C:/Users/rrwth/OneDrive/Documents/College/ECE350/Checkpoints/processor/MemoryMap.v:26]
WARNING: [Synth 8-327] inferring latch for variable 'SD_start_reg' [C:/Users/rrwth/OneDrive/Documents/College/ECE350/Checkpoints/processor/MemoryMap.v:32]
---------------------------------------------------------------------------------
Finished RTL Optimization Phase 2 : Time (s): cpu = 00:00:17 ; elapsed = 00:00:18 . Memory (MB): peak = 1087.145 ; gain = 73.652
---------------------------------------------------------------------------------
---------------------------------------------------------------------------------
Start RTL Component Statistics 
---------------------------------------------------------------------------------
Detailed RTL Component Info : 
+---Adders : 
	   2 Input    5 Bit       Adders := 1     
+---XORs : 
	   3 Input      1 Bit         XORs := 129   
	   2 Input      1 Bit         XORs := 4     
+---Registers : 
	               48 Bit    Registers := 1     
	               32 Bit    Registers := 1     
	               31 Bit    Registers := 1     
	                8 Bit    Registers := 2     
	                5 Bit    Registers := 1     
	                1 Bit    Registers := 1509  
+---RAMs : 
	             128K Bit	(4096 X 32 bit)          RAMs := 1     
+---ROMs : 
	                    ROMs := 1     
+---Muxes : 
	   2 Input   48 Bit        Muxes := 2     
	   4 Input   48 Bit        Muxes := 1     
	   2 Input   32 Bit        Muxes := 50    
	   4 Input   32 Bit        Muxes := 1     
	   2 Input    5 Bit        Muxes := 8     
	   3 Input    5 Bit        Muxes := 1     
	   3 Input    2 Bit        Muxes := 1     
	   2 Input    1 Bit        Muxes := 12    
	   4 Input    1 Bit        Muxes := 1     
---------------------------------------------------------------------------------
Finished RTL Component Statistics 
---------------------------------------------------------------------------------
---------------------------------------------------------------------------------
Start Part Resource Summary
---------------------------------------------------------------------------------
Part Resources:
DSPs: 240 (col length:80)
BRAMs: 270 (col length: RAMB18 80 RAMB36 40)
---------------------------------------------------------------------------------
Finished Part Resource Summary
---------------------------------------------------------------------------------
---------------------------------------------------------------------------------
Start Cross Boundary and Area Optimization
---------------------------------------------------------------------------------
---------------------------------------------------------------------------------
Finished Cross Boundary and Area Optimization : Time (s): cpu = 00:00:47 ; elapsed = 00:00:48 . Memory (MB): peak = 1090.801 ; gain = 77.309
---------------------------------------------------------------------------------
---------------------------------------------------------------------------------
Start ROM, RAM, DSP and Shift Register Reporting
---------------------------------------------------------------------------------

ROM: Preliminary Mapping	Report
+------------+---------------------+---------------+----------------+
|Module Name | RTL Object          | Depth x Width | Implemented As | 
+------------+---------------------+---------------+----------------+
|Wrapper     | InstMem/dataOut_reg | 4096x31       | Block RAM      | 
+------------+---------------------+---------------+----------------+


Block RAM: Preliminary Mapping	Report (see note below)
+------------+-----------------+------------------------+---+---+------------------------+---+---+------------------+--------+--------+
|Module Name | RTL Object      | PORT A (Depth x Width) | W | R | PORT B (Depth x Width) | W | R | Ports driving FF | RAMB18 | RAMB36 | 
+------------+-----------------+------------------------+---+---+------------------------+---+---+------------------+--------+--------+
|ProcMem     | MemoryArray_reg | 4 K x 32(NO_CHANGE)    | W | R |                        |   |   | Port A           | 0      | 4      | 
+------------+-----------------+------------------------+---+---+------------------------+---+---+------------------+--------+--------+

Note: The table above is a preliminary report that shows the Block RAMs at the current stage of the synthesis flow. Some Block RAMs may be reimplemented as non Block RAM primitives later in the synthesis flow. Multiple instantiated Block RAMs are reported only once. 
---------------------------------------------------------------------------------
Finished ROM, RAM, DSP and Shift Register Reporting
---------------------------------------------------------------------------------
---------------------------------------------------------------------------------
Start Applying XDC Timing Constraints
---------------------------------------------------------------------------------
---------------------------------------------------------------------------------
Finished Applying XDC Timing Constraints : Time (s): cpu = 00:00:54 ; elapsed = 00:00:56 . Memory (MB): peak = 1090.801 ; gain = 77.309
---------------------------------------------------------------------------------
---------------------------------------------------------------------------------
Start Timing Optimization
---------------------------------------------------------------------------------
---------------------------------------------------------------------------------
Finished Timing Optimization : Time (s): cpu = 00:00:56 ; elapsed = 00:00:57 . Memory (MB): peak = 1090.801 ; gain = 77.309
---------------------------------------------------------------------------------
---------------------------------------------------------------------------------
Start ROM, RAM, DSP and Shift Register Reporting
---------------------------------------------------------------------------------

Block RAM: Final Mapping	Report
+------------+-----------------+------------------------+---+---+------------------------+---+---+------------------+--------+--------+
|Module Name | RTL Object      | PORT A (Depth x Width) | W | R | PORT B (Depth x Width) | W | R | Ports driving FF | RAMB18 | RAMB36 | 
+------------+-----------------+------------------------+---+---+------------------------+---+---+------------------+--------+--------+
|ProcMem     | MemoryArray_reg | 4 K x 32(NO_CHANGE)    | W | R |                        |   |   | Port A           | 0      | 4      | 
+------------+-----------------+------------------------+---+---+------------------------+---+---+------------------+--------+--------+

---------------------------------------------------------------------------------
Finished ROM, RAM, DSP and Shift Register Reporting
---------------------------------------------------------------------------------
---------------------------------------------------------------------------------
Start Technology Mapping
---------------------------------------------------------------------------------
INFO: [Synth 8-7052] The timing for the instance ProcMem/MemoryArray_reg_0 (implemented as a Block RAM) might be sub-optimal as no optional output register could be merged into the ram block. Providing additional output register may help in improving timing.
INFO: [Synth 8-7052] The timing for the instance ProcMem/MemoryArray_reg_1 (implemented as a Block RAM) might be sub-optimal as no optional output register could be merged into the ram block. Providing additional output register may help in improving timing.
INFO: [Synth 8-7052] The timing for the instance ProcMem/MemoryArray_reg_2 (implemented as a Block RAM) might be sub-optimal as no optional output register could be merged into the ram block. Providing additional output register may help in improving timing.
INFO: [Synth 8-7052] The timing for the instance ProcMem/MemoryArray_reg_3 (implemented as a Block RAM) might be sub-optimal as no optional output register could be merged into the ram block. Providing additional output register may help in improving timing.
INFO: [Synth 8-7052] The timing for the instance InstMem/dataOut_reg_0 (implemented as a Block RAM) might be sub-optimal as no optional output register could be merged into the ram block. Providing additional output register may help in improving timing.
INFO: [Synth 8-7052] The timing for the instance InstMem/dataOut_reg_1 (implemented as a Block RAM) might be sub-optimal as no optional output register could be merged into the ram block. Providing additional output register may help in improving timing.
INFO: [Synth 8-7052] The timing for the instance InstMem/dataOut_reg_2 (implemented as a Block RAM) might be sub-optimal as no optional output register could be merged into the ram block. Providing additional output register may help in improving timing.
INFO: [Synth 8-7052] The timing for the instance InstMem/dataOut_reg_3 (implemented as a Block RAM) might be sub-optimal as no optional output register could be merged into the ram block. Providing additional output register may help in improving timing.
---------------------------------------------------------------------------------
Finished Technology Mapping : Time (s): cpu = 00:00:58 ; elapsed = 00:00:59 . Memory (MB): peak = 1136.285 ; gain = 122.793
---------------------------------------------------------------------------------
---------------------------------------------------------------------------------
Start IO Insertion
---------------------------------------------------------------------------------
---------------------------------------------------------------------------------
Start Flattening Before IO Insertion
---------------------------------------------------------------------------------
---------------------------------------------------------------------------------
Finished Flattening Before IO Insertion
---------------------------------------------------------------------------------
---------------------------------------------------------------------------------
Start Final Netlist Cleanup
---------------------------------------------------------------------------------
---------------------------------------------------------------------------------
Finished Final Netlist Cleanup
---------------------------------------------------------------------------------
CRITICAL WARNING: [Synth 8-6030] Inout pin 'SD[7]' is read and/or written without using tristate logic. Proper direction of connection may be wrongly inferred. Please use specific direction to avoid any incorrect logic issue [C:/Users/rrwth/OneDrive/Documents/College/ECE350/Checkpoints/processor/Wrapper.v:27]
CRITICAL WARNING: [Synth 8-6030] Inout pin 'SD[6]' is read and/or written without using tristate logic. Proper direction of connection may be wrongly inferred. Please use specific direction to avoid any incorrect logic issue [C:/Users/rrwth/OneDrive/Documents/College/ECE350/Checkpoints/processor/Wrapper.v:27]
CRITICAL WARNING: [Synth 8-6030] Inout pin 'SD[5]' is read and/or written without using tristate logic. Proper direction of connection may be wrongly inferred. Please use specific direction to avoid any incorrect logic issue [C:/Users/rrwth/OneDrive/Documents/College/ECE350/Checkpoints/processor/Wrapper.v:27]
CRITICAL WARNING: [Synth 8-6030] Inout pin 'SD[4]' is read and/or written without using tristate logic. Proper direction of connection may be wrongly inferred. Please use specific direction to avoid any incorrect logic issue [C:/Users/rrwth/OneDrive/Documents/College/ECE350/Checkpoints/processor/Wrapper.v:27]
CRITICAL WARNING: [Synth 8-6030] Inout pin 'SD[3]' is read and/or written without using tristate logic. Proper direction of connection may be wrongly inferred. Please use specific direction to avoid any incorrect logic issue [C:/Users/rrwth/OneDrive/Documents/College/ECE350/Checkpoints/processor/Wrapper.v:27]
CRITICAL WARNING: [Synth 8-6030] Inout pin 'SD[2]' is read and/or written without using tristate logic. Proper direction of connection may be wrongly inferred. Please use specific direction to avoid any incorrect logic issue [C:/Users/rrwth/OneDrive/Documents/College/ECE350/Checkpoints/processor/Wrapper.v:27]
CRITICAL WARNING: [Synth 8-6030] Inout pin 'SD[1]' is read and/or written without using tristate logic. Proper direction of connection may be wrongly inferred. Please use specific direction to avoid any incorrect logic issue [C:/Users/rrwth/OneDrive/Documents/College/ECE350/Checkpoints/processor/Wrapper.v:27]
CRITICAL WARNING: [Synth 8-6030] Inout pin 'SD[0]' is read and/or written without using tristate logic. Proper direction of connection may be wrongly inferred. Please use specific direction to avoid any incorrect logic issue [C:/Users/rrwth/OneDrive/Documents/College/ECE350/Checkpoints/processor/Wrapper.v:27]
---------------------------------------------------------------------------------
Finished IO Insertion : Time (s): cpu = 00:01:02 ; elapsed = 00:01:03 . Memory (MB): peak = 1142.137 ; gain = 128.645
---------------------------------------------------------------------------------
---------------------------------------------------------------------------------
Start Renaming Generated Instances
---------------------------------------------------------------------------------
---------------------------------------------------------------------------------
Finished Renaming Generated Instances : Time (s): cpu = 00:01:02 ; elapsed = 00:01:03 . Memory (MB): peak = 1142.137 ; gain = 128.645
---------------------------------------------------------------------------------
---------------------------------------------------------------------------------
Start Rebuilding User Hierarchy
---------------------------------------------------------------------------------
---------------------------------------------------------------------------------
Finished Rebuilding User Hierarchy : Time (s): cpu = 00:01:02 ; elapsed = 00:01:04 . Memory (MB): peak = 1142.137 ; gain = 128.645
---------------------------------------------------------------------------------
---------------------------------------------------------------------------------
Start Renaming Generated Ports
---------------------------------------------------------------------------------
---------------------------------------------------------------------------------
Finished Renaming Generated Ports : Time (s): cpu = 00:01:02 ; elapsed = 00:01:04 . Memory (MB): peak = 1142.137 ; gain = 128.645
---------------------------------------------------------------------------------
---------------------------------------------------------------------------------
Start Handling Custom Attributes
---------------------------------------------------------------------------------
---------------------------------------------------------------------------------
Finished Handling Custom Attributes : Time (s): cpu = 00:01:03 ; elapsed = 00:01:04 . Memory (MB): peak = 1142.336 ; gain = 128.844
---------------------------------------------------------------------------------
---------------------------------------------------------------------------------
Start Renaming Generated Nets
---------------------------------------------------------------------------------
---------------------------------------------------------------------------------
Finished Renaming Generated Nets : Time (s): cpu = 00:01:03 ; elapsed = 00:01:04 . Memory (MB): peak = 1142.336 ; gain = 128.844
---------------------------------------------------------------------------------
---------------------------------------------------------------------------------
Start Writing Synthesis Report
---------------------------------------------------------------------------------

Report BlackBoxes: 
+------+--------------+----------+
|      |BlackBox name |Instances |
+------+--------------+----------+
|1     |ila_0         |         1|
+------+--------------+----------+

Report Cell Usage: 
+------+---------+------+
|      |Cell     |Count |
+------+---------+------+
|1     |ila      |     1|
|2     |BUFG     |     4|
|3     |LUT1     |     7|
|4     |LUT2     |   312|
|5     |LUT3     |   411|
|6     |LUT4     |   244|
|7     |LUT5     |   529|
|8     |LUT6     |  1559|
|9     |MUXF7    |     1|
|10    |RAMB36E1 |     8|
|15    |FDCE     |  1392|
|16    |FDRE     |   140|
|17    |LD       |    49|
|18    |IBUF     |    11|
|19    |OBUF     |    28|
+------+---------+------+
---------------------------------------------------------------------------------
Finished Writing Synthesis Report : Time (s): cpu = 00:01:03 ; elapsed = 00:01:04 . Memory (MB): peak = 1142.336 ; gain = 128.844
---------------------------------------------------------------------------------
Synthesis finished with 0 errors, 8 critical warnings and 2 warnings.
Synthesis Optimization Runtime : Time (s): cpu = 00:00:52 ; elapsed = 00:01:00 . Memory (MB): peak = 1142.336 ; gain = 55.191
Synthesis Optimization Complete : Time (s): cpu = 00:01:03 ; elapsed = 00:01:04 . Memory (MB): peak = 1142.336 ; gain = 128.844
INFO: [Project 1-571] Translating synthesized netlist
Netlist sorting complete. Time (s): cpu = 00:00:00 ; elapsed = 00:00:00.118 . Memory (MB): peak = 1154.434 ; gain = 0.000
INFO: [Netlist 29-17] Analyzing 58 Unisim elements for replacement
INFO: [Netlist 29-28] Unisim Transformation completed in 0 CPU seconds
INFO: [Project 1-570] Preparing netlist for logic optimization
INFO: [Opt 31-138] Pushed 0 inverter(s) to 0 load pin(s).
Netlist sorting complete. Time (s): cpu = 00:00:00 ; elapsed = 00:00:00.009 . Memory (MB): peak = 1154.434 ; gain = 0.000
INFO: [Project 1-111] Unisim Transformation Summary:
  A total of 49 instances were transformed.
  LD => LDCE: 49 instances

INFO: [Common 17-83] Releasing license: Synthesis
87 Infos, 20 Warnings, 8 Critical Warnings and 0 Errors encountered.
synth_design completed successfully
synth_design: Time (s): cpu = 00:01:10 ; elapsed = 00:01:13 . Memory (MB): peak = 1154.434 ; gain = 140.941
INFO: [Common 17-600] The following parameters have non-default value.
tcl.collectionResultDisplayLimit
INFO: [Common 17-1381] The checkpoint 'C:/Users/rrwth/OneDrive/Documents/College/ECE350/Checkpoints/processor/Vivado/Vivado.runs/synth_1/Wrapper.dcp' has been generated.
INFO: [runtcl-4] Executing : report_utilization -file Wrapper_utilization_synth.rpt -pb Wrapper_utilization_synth.pb
INFO: [Common 17-206] Exiting Vivado at Tue Apr 11 16:39:34 2023...
